{
  "run_id": "sample-completed",
  "collected_at": "2026-05-20T12:00:00+00:00",
  "username_ref": "usuario",
  "record_count": 1,
  "visited_page_count": 1,
  "records": [
    {
      "point_date": "2026-05-20",
      "entry_times": ["08:00", "13:00"],
      "exit_times": ["12:00", "17:00"],
      "source_url": "https://sigrh.ifes.edu.br/sigrh/frequencia/espelho.jsf",
      "collected_at": "2026-05-20T12:00:00+00:00"
    }
  ],
  "output_path": "data/runs/crawl-result-sample-completed.json",
  "status": "completed",
  "message": null
}

